Name,Slug,Collection ID,Item ID,Created On,Updated On,Published On,Video,Content,Lesson Number
Turn on Integromat and launch the live site,turn-on-integromat-and-launch-the-live-site,5f9e4d50428c5838595b842d,5fa31d0692fab8a2fbdc661d,Wed Nov 04 2020 21:28:38 GMT+0000 (Coordinated Universal Time),Wed Nov 04 2020 21:28:38 GMT+0000 (Coordinated Universal Time),Wed Nov 04 2020 21:28:44 GMT+0000 (Coordinated Universal Time),https://youtu.be/_6UgbkxSaZ8,<p>Done! Just turn on Integromat and you’ve now launched the live site.</p><p><br></p>,8
Setup last Integromat Module,setup-last-integromat-module,5f9e4d50428c5838595b842d,5fa31cdc7ccc4494cf97a8fa,Wed Nov 04 2020 21:27:56 GMT+0000 (Coordinated Universal Time),Wed Nov 04 2020 21:27:56 GMT+0000 (Coordinated Universal Time),Wed Nov 04 2020 21:28:44 GMT+0000 (Coordinated Universal Time),https://youtu.be/G3UcceljhF8,<p>Add another module off of the Webflow module you created in the last step. Select the Webhooks response module.</p><p>You’re going to send a reply back to the web browser telling it to redirect to the newly created CMS record 👍</p><p>‍</p>,7
"Create the Profile Page, Form Redirect, and Add Custom Code",create-the-profile-page-form-redirect-and-add-custom-code,5f9e4d50428c5838595b842d,5fa31cb6aac8a45da58e889e,Wed Nov 04 2020 21:27:18 GMT+0000 (Coordinated Universal Time),Wed Nov 04 2020 21:27:18 GMT+0000 (Coordinated Universal Time),Wed Nov 04 2020 21:28:44 GMT+0000 (Coordinated Universal Time),https://youtu.be/4FyXJZkd2kE,"<p>Let’s create the Collection Template Page that displays your forms info, make sure we are redirecting to it after our background job (a.k.a. Integromat) is done, and sprinkle on a little custom Javascript code 😱</p><p>Never fear! You’ll simply copy &amp; paste it, no coding skills required 😅</p><p><a href=""https://github.com/NoCodeQuest/Send-Form-Submission-To-Webflow-CMS/blob/main/submitForm.js"" target=""_blank"">Here is the Custom Code shown in the video</a> ⚙️</p><p>Great! Now you’ll add the last Integromat module that tells your web browser what to do.</p><p>‍</p>",6
Setup the Integromat Webflow Module,setup-the-integromat-webflow-module,5f9e4d50428c5838595b842d,5fa31b504f00617ca7754a0e,Wed Nov 04 2020 21:21:20 GMT+0000 (Coordinated Universal Time),Wed Nov 04 2020 21:26:05 GMT+0000 (Coordinated Universal Time),Wed Nov 04 2020 21:28:44 GMT+0000 (Coordinated Universal Time),https://youtu.be/Ne_aCh555vo,"<p>Add another module off of the first Webhooks module that you just created. This will be a Webflow module and you’ll use it to create a live item in your Webflow CMS Collection 😅</p><p>Once that’s setup, you’ll go back to your live site and submit the form with some test info.</p><ul><li>Confirm that Integromat captured the form submission</li><li>Integromat created a new live item in your CMS Collection</li><li>View your CMS Collection within Webflow</li><li>Find your form info just submitted</li></ul><p>💥bam!</p><p>Alright, this is getting exciting now!</p><p>‍</p>",5
Setup Integromat,setup-integromat,5f9e4d50428c5838595b842d,5fa31ae3d4e6703e0cb992d1,Wed Nov 04 2020 21:19:31 GMT+0000 (Coordinated Universal Time),Wed Nov 04 2020 21:25:19 GMT+0000 (Coordinated Universal Time),Wed Nov 04 2020 21:28:44 GMT+0000 (Coordinated Universal Time),https://youtu.be/SRtqaFmkx0Q,"<p>Create a new scenario with a Webhooks module as the trigger. This will give you an url endpoint that you then add as the Webflow forms action.</p><p>This is where the visitor goes after tapping the form submit button 😎</p><p>While our background job is running (a.k.a. Integromat) the visitor will see a loading spinner with the friendly success message adjusted in the previous section.</p><p>Once Integromat receives the form submission, it passes the request to the next module. Set that up now…</p><p>‍</p>",4
Create the home page,create-the-home-page,5f9e4d50428c5838595b842d,5fa31abf1acb192c440173b9,Wed Nov 04 2020 21:18:55 GMT+0000 (Coordinated Universal Time),Wed Nov 04 2020 21:23:17 GMT+0000 (Coordinated Universal Time),Wed Nov 04 2020 21:28:44 GMT+0000 (Coordinated Universal Time),https://youtu.be/kx1rDxVIuNQ,<ul><li>Setup the Webflow home page</li><li>Add a native Webflow form to the page</li><li>Update success/fail messages on the form</li><li>Add some very specific id’s to select elements</li></ul><p>Make sure the element id’s are added exactly as shown. Theses id’s will match up with some custom Javascript code you’ll be pasting into the home page (in the next few steps).</p><p>Onto the backend!</p><p>Integromat will be our server-less backend to our Webflow site. Here’s how you set that up…</p><p>‍</p>,3
Setup the CMS Collection,setup-the-cms-collection,5f9e4d50428c5838595b842d,5fa31a85cdb9c3031d3f07e5,Wed Nov 04 2020 21:17:57 GMT+0000 (Coordinated Universal Time),Wed Nov 04 2020 22:15:01 GMT+0000 (Coordinated Universal Time),Wed Nov 04 2020 22:16:01 GMT+0000 (Coordinated Universal Time),https://youtu.be/l653rTW9-pM,"<p>Setup a simple CMS Collection in Webflow to store the info that the site visitor submitted from the form.</p><p>Next, setup the home page…</p><p>‍</p>",2
Here's what you're building,heres-what-youre-building,5f9e4d50428c5838595b842d,5fa31609e628bd8403255841,Wed Nov 04 2020 20:58:49 GMT+0000 (Coordinated Universal Time),Wed Nov 04 2020 21:24:27 GMT+0000 (Coordinated Universal Time),Wed Nov 04 2020 21:28:44 GMT+0000 (Coordinated Universal Time),https://youtu.be/O5uxz6Lsq58,"<p>A super quick run through of this working in action.</p><ul><li>Native Webflow form</li><li>Built in the Webflow Designer</li><li>Site visitor submits the form</li><li>In the background…</li><li>Integromat captures the form submission</li><li>Integromat creates a new live CMS item in Webflow</li><li>Integromat replys to the web browser and redirects the visitor</li><li>The visitor is automatically redirected to their unique page (CMS Collection Page)</li><li>The Webflow CMS Collection has a new live Item with the form submission info!</li></ul><p>😎</p><p>Next, setup the CMS Collection in Webflow…</p><p>‍</p>",1
